,sentences,source,article_id
42527,"Authorities in China probed Uber in Chinese megacity Chongqing last year, and Guangzhou and Chengdu earlier this month, over whether its drivers were operating illegally.",Reuters,9375
76423,"""These are shortterm market dynamics,"" Air Lease Corp Chief Executive Officer Steven UdvarHazy told Reuters, referring to oil price moves.",Reuters,13616
15239,"On Monday, during a conference call with investors, Valeant defended its pricing and declined to comment on the federal investigations, saying it was cooperating with authorities.",Reuters,3228
87940,"In an email sent to staff on Friday, Chief Executive Dave Lewis said: ""Turning our business around will require change in our culture, as well as in our processes and our brand proposition.",Reuters,14427
11122,"the last 12 months, we have doubled our sourcing from India and are committed to continue that journey,"" said Pratyush Kumar, President of Boeing India.",Reuters,2443
102728,"Sales growth in the luxury goods industry, which bounced back between 2010 and 2012 after the financial crisis, has been slowing in the past two years, hit by China's crackdown on corruption and conspicuous spending.",Reuters,15589
17855,"""Standard Chartered has also been fined more than $1 billion for breaching U.S. sanctions, including with Iran, and authorities there are still investigating some issues.",Reuters,3736
44342,"Buoyed by 6.7 billion euros of liquidity reserves cash, Hanoverbased Continental also hopes to benefit from acquisitions, especially in nonautomotive segments, after concluding the purchase of U.S. rubber company Veyance Technologies this year.",Reuters,9745
38111,"Marcato Capital Management has been calling on NCR since last year to explore strategic alternatives, and now holds a seat on its board of directors.",Reuters,8377
21318," U.S. stocks ended down slightly on Wednesday, led by losses in materials and energy shares as weak Chinese and U.S. factory data added to growth worries.",Reuters,4380
77563,"Ford now links Lincoln's success to China, where the company opened its first dealerships this week and plans to have 60 stores in 50 Chinese cities by 2016.",Reuters,13698
93695,"The A320neo is being readied for its first test flight with engines from Pratt & Whitney (N:UTX), expected in the second half of the month.",Reuters,14859
61960,"Wilson, who founded Lululemon in 1998, withdrew from daytoday management in early 2012, and stepped down as chairman in late 2013.",Reuters,12269
36930,"Chrysler 300C, as well as  Renault  SA (PA:RENA) and Ford vehicles, the Ministry of Land, Infrastructure and Transport said in a statement.",Reuters,8085
39883,"Syngenta's integrated business model of folding seeds into its pesticides business has missed expectations in core markets such as Western Europe and the United States, analysts say.",Reuters,8749
44629,"  Standard Chartered  (L:STAN) said it continued to keep its domicile under review, particularly given the likelihood Britain's bank tax will continue to rise, raising the prospect it could leave London for Asia.",Reuters,9803
43570, Airbus (PA:AIR) carried out on Tuesday its first test flight of an A400M military transporter plane since Saturday's fatal crash in Spain that led some European countries to ground the carriers.,Reuters,9589
21311,The company's stock is down 26 percent so far this year.,Reuters,4377
78167, (Editing by Nick Zieminski),Reuters,13734
40416,"Etihad said Open Skies policy does not define subsidy, but its main concern is to stop subsidies from lowering airfare artificially.",Reuters,8872
24219,"Lufthansa had tried to stop the strike, the 13th in 18 months, with a temporary injunction but on Tuesday night two courts ruled in favor of the pilots' union, Vereinigung Cockpit.",Reuters,5028
75563,"""The value of imports from Europe was up 60 percent to $4.6 billion in the first nine months of 2014, customs data showed, against exports of $4.4 billion.",Reuters,13543
72877,"The German automaker said on Monday it will expand capacity at Deutsche ACCUmotive, its batterymaking division in Saxony as it expects ""high and steadilygrowing demand"" for electriccar batteries.",Reuters,13318
57544,"Williams says his views have changed, and he now supports UAW representation on boards.",Reuters,11816
69643,"In October, AT&T Inc agreed to pay $105 million to settle similar cramming allegations in a case negotiated by the FCC and the Federal Trade Commission.",Reuters,13068
25499,"After a relatively upbeat few days for world markets, concerns about China were reignited by surveys that showed its giant manufacturing sector shrinking at its fastest pace in three years and its services sector also cooling.",Reuters,5363
80767,"The U.S. National Highway Traffic Safety Administration said in documents posted online that it is looking at delays in the availability of replacement parts in two recalls from last year, as well as ""poor communications"" by Chrysler (N:FCAU) with the safety agency.",Reuters,13911
17642,"But several former managers in the VW group  whose brands also include Audi, Porsche, SEAT and Skoda  said few executives dared approach Winterkorn.DISTANCE, FEAR,",Reuters,3697
44679,"Net income attributable to shareholders fell to $23 million, or 4 cents per share, for the third quarter ended March 31, from $48 million, or 8 cents per share, a year earlier.",Reuters,9816
59443,The S&P 500 (SPX) index had finished the regular session unchanged on Wednesday as investors were worried about making big bets while they waited for the outcome of the Greece talks.,Reuters,12014
51283,Chinese central bank governor Zhou Xiaochuan's recent warning that China needs to be vigilant for signs of deflation have also helped fuel hopes for more easing.,Reuters,10949
46031,The Conference Board's latest measure of U.S. consumer confidence on Tuesday hit its lowest level since December.,Reuters,10039
7447,"Against the yen, the euro fell 0.2 percent to 130.12 yen, a day after hitting a sevenmonth low of 129.77 (EURJPY=R).Market activity was thin due to the U.S. holiday, with the greenback trading in a tight range.",Reuters,1653
30882,Investors have been eager to see how industrial companies use their capital as many of their markets struggle for growth.,Reuters,6720
82990,"Preorders start Friday for the larger iPad Air 2, priced at $499 and up, with shipping beginning next week.",Reuters,14080
65170,"Adding to volatility, the Swiss National Bank scrapped its cap on the franc currency in a surprise move.U.S.traded Swiss stocks climbed.",Reuters,12599
69143,"""Edward Snowden did more to create a future with many clouds in many locations than any tech company has done,"" said Steve Herrod, the former chief technology officer of VMware Inc, now a venture capitalist at General Catalyst Partners.",Reuters,13010
19624,"""We will gather the issues together and notify (Fiat Chrysler) that further discussions are needed,"" Williams said in a statement.",Reuters,4048
52424,"""People are prepared for the strength of the dollar to hurt earnings, but by how much they don't know yet,"" said Polcari.",Reuters,11172
107655,Benmosche will retire from AIG in September this year.,Reuters,16083
65224,"Senior Morgan Stanley executives in New York, including Chief Executive Officer James Gorman, had been calling staff members to congratulate them on their promotions, Reuters reported earlier in the day.",Reuters,12604
41702,"Investor support for such new director nomination rules, referred to as ""proxy access,"" is growing.",Reuters,9230
15925,"Spokesman Bill Durling said the company, whose merchant teams are separate from those at the Walmart chain, had recently changed its structure so that one account head now manages the relationship across various products, with the ability to see across the work of multiple buyers.",Reuters,3390
17350,Conversations with at least four other craft brewers told the same story.,Reuters,3640
56065,Barclays also set aside an extra 200 million pounds in the fourth quarter to compensate British customers who were missold insurance products.,Reuters,11621
80332,"On Wednesday, Germany's largest lender Deutsche Bank (DE:DBKGn) announced a thirdquarter net loss, and French oil major Total (PA:TOTF) said net adjusted profit fell 2 percent.",Reuters,13869
26907,"""However, strategists at  Societe Generale  (PARIS:SOGN) warned that their basket of European stocks with strong business ties to China, which includes carmakers and luxury goods companies, might come under more selling pressure in the nearterm.",Reuters,5688
41879,"The fines announced on Wednesday follow agreements in November with many of the same banks over currency trading and bring total penalties to nearly $9 billion, the Justice Department said.",Reuters,9247
276,"Japan's Nikkei (N225) fell 1.3 percent after a market holiday on Monday, hitting a threemonth low and down over 8 percent so far this year while Chinese stocks  swung around in volatile opening trades.",Reuters,63
105485,"Concern over the exposure of Banco Espirito Santo (BES), the country's largest listed lender, to the troubled companies of its founding family has been a main driver of trading in recent days.",Reuters,15830
108350,"The Barclays complaint, which is based on internal communications provided by former employees, says that while the firm told clients it would keep predatory high frequency traders out of its dark pool, it never actually prevented any trader from participating, the source said.",Reuters,16170
8535,"Funding for the deal with Mobile Leasing Solutions (MLS), the company formed by SoftBank and other investors, would come from several lenders including international banks and leasing companies.",Reuters,1894
3116,The Securities and Exchange Commission said that two of the bank's wealth management units have agreed to admit to wrongdoing and pay $267 million to settle the charges.,Reuters,747
75949,"""But while we're waiting for (other) consumer stocks to rise, lower energy prices continue to be a headwind,"" Hogan said.",Reuters,13571
7711,"The Oklahoma fund's lawsuit accused Herbalife of ""grossly"" understating the percentage of sales going to retail customers.",Reuters,1726
33357,"""That's one significant ... legacy item that we look forward to getting behind us,"" Goldman's chief financial officer, Harvey Schwartz, said on a conference call on Thursday.",Reuters,7200
102131,"Banking revenue from small and mediumsized companies in emerging markets is set to grow at a rate of 20 percent per year and could reach over $350 billion by 2015, up from $150 billion in 2010, according to a survey by McKinsey & Company.",Reuters,15541
44746,"""Lund took office on Feb. 9, nearly a month earlier than initially planned, with a mandate to turn BG around after a string of profit warnings and delays on major projects.",Reuters,9842
1740,"Hans Vontobel joined the bank in 1943, seven years after his father set up J. Vontobel & Co.",Reuters,388
7445,That fueled talk that the central bank is preparing aggressive measures to lift inflation and economic growth in the 19member euro zone.,Reuters,1653
73793,"""The rapid growth being achieved in nonOPEC production means it faces the risk that even a large cut to supply may not be enough to support prices and could simply result in lost market share and revenue,"" they said.",Reuters,13391
11359,It did not name a successor.,Reuters,2478
62185,The allegations involving Epstein became a tabloid sensation on both sides of the Atlantic after lawyers for one of Epstein's accusers made them in a court filing just over a month ago.,Reuters,12288
101319,"Burger King last week suspended the sale of any products from the Husi factories in Shanghai that supplied its restaurants and launched an investigation, Alix Salyers, a spokeswoman for the Miamibased chain, said in an email.",Reuters,15461
1720,"Google has a limited presence in China, although the company has signaled it could expand there.",Reuters,385
39772,"Another 500,000 of those parts appear to be safe, according to U.S. safety regulators, leaving the safety of more than 3 million replacement parts in question.",Reuters,8738
17538,"The case is the first by the U.S. Justice Department to go to trial over allegations that financial institutions manipulated Libor, or the London interbank offered rate, a shortterm rate banks charge each other for loans.",Reuters,3689
90941,"Flush with cash, farmers went shopping.",Reuters,14654
878," U.S. stocks sold off further on Thursday, giving the Dow and S&P 500 their worst fourday starts to a year ever, dragged down by another drop in Chinese equities and oil prices at 12year lows.",Reuters,181
12085,"Target stores nationwide have some 8 to 9 billion items on store floors, in transit or in warehouses at any given time, he said.",Reuters,2624
43793,"Germany's Audi (DE:VOWG_p), BMW (DE:BMWG) and MercedesBenz (DE:DAIGn) are among luxury carmakers that have recently announced new production capacity in the region.",Reuters,9639
3285,"The company is also seeking FDA approval for its E4 device, a researchgrade version for use in clinical trials.",Reuters,781
104939,"Rather than talking about further expansion, top managers at VW  concerned that profitability gains aren't keeping pace with the company's steadilygrowing size  have been pushing a new efficiency program that includes 5 billion euros of cost cuts per year at the core passengercar brand.",Reuters,15791
37357,"It is not part of the previously announced plans for the same plant to build the Bolt, a smaller electric vehicle, a GM spokesman said.",Reuters,8203
8232,"The ""radical action"" would give the Cincinnatibased company a chance to contend with more ""agile competitors,"" according to Barron's report this weekend.",Reuters,1855
11338,"Verizon is still considering how some of these asset sales could best be structured and no deal is imminent, the people added.",Reuters,2477
23189,"""Many people live in the west and we just built a factory there.",Reuters,4776
29706,"RBS was briefly the world's biggest bank by assets, but has more than halved its assets and the size of its investment bank and sold businesses around the world.",Reuters,6450
12585,"Within Asia, Jakarta (JKSE) and Hong Kong (HSI) led the region higher.",Reuters,2695
95609,The order is part of BOC Aviation's strategy to build its fleet for the next seven years.,Reuters,15036
16610,"We must become leaner and take decisions more rapidly,"" Mueller said of his recovery plan.",Reuters,3477
82907, (Reporting by Caroline Copley; Additional reporting by Katharina Bart; Editing by Ryan Woo),Reuters,14073
108124,"Takata cited the two Japanese automakers in its letter, posted on an NHTSA website.",Reuters,16124
67018,WHY TAKE THE MONEY?,Reuters,12769
94435,"Immediate focus was on the ISM's report on U.S. manufacturing due later in the day, which might point to the U.S. phasing out quantitative easing just as the ECB contemplates its adoption.",Reuters,14929
107373," Daimler (DE:DAIGn) management wants to cut costs further at its truck plants in Germany, an objective which could threaten around 2,000 jobs, labor representative and deputy supervisory board chairman Michael Brecht said on Wednesday.",Reuters,16059
44949,"By comparison, the Vanguard Total Bond Market Index Fund had $117.3 billion as of April 30, according to a Vanguard spokesman.",Reuters,9869
40580,"It's also Friday and Greece worries are still in the marketplace,"" said Peter Cardillo, chief market economist at Rockwell Global Capital in New York.",Reuters,8931
76826, (Reporting by Ilona Wissenbach; Writing by Edward Taylor; editing by Keith Weir),Reuters,13634
76524,"The case is Moore et al v. Apple Inc, U.S. District Court, Northern District of California, No. 1402269.",Reuters,13624
108906,"Some of the extra spending would be directed to supplying large batteries used by other electric vehicle makers, Ito said.",Reuters,16437
70477,"More recently, it won an exemption from safety rules that threatened U.S. sales of the coupe and convertible versions of its DB9 and Vantage models.",Reuters,13134
84480,"The pricey content deal comes as Turner, which also operates the 24hour news channel CNN, attempts to crack down on costs.",Reuters,14187
97968,"A spokesman, Jonathan Gasthalter, declined to comment.",Reuters,15214
63818,"UPS (N:UPS) was among the largest drags on the S&P 500 after a gloomy outlook, alongside Exxon Mobil (N:XOM).",Reuters,12454
31693,"Slowing Chinese growth means less demand for commodities such as iron ore, one of Australia's chief exports.",Reuters,6877
53369,"Apple Watch is not a real watch but a consumer electronic,"" he told Reuters in Basel on Thursday.",Reuters,11252
91882,"Berry, who has a law degree from the University of California Hastings College of the Law in San Francisco, joined the regulator in 1995, according to his LinkedIn profile.",Reuters,14713
19056,"""It's having trouble finding a way to create new demand for its smartphones.",Reuters,3940
51872,He also holds restricted stock worth $665 million if it were to be fully vested.,Reuters,11051
52733,"Boeing, prime contractor for the GPS IIF satellites, had no immediate comment on the news, which comes days before the Air Force is due to launch the ninth GPS IIF satellite into space.",Reuters,11197
14366,"""If a customer of mine had that kind of experience, they'd never order from me again,"" Beets said.",Reuters,3037
15912, Suppliers of everything from groceries to sports equipment are already being squeezed for price cuts and cost sharing by WalMart Stores (N:WMT).,Reuters,3390
80215,"The Fed also dropped a characterization of U.S. labor market slack as ""significant"" in a show of confidence in the economy's prospects.",Reuters,13860
106297,Last month American Apparel's board dismissed Charney.,Reuters,15953
90778,"It has said it does not expect to raise rates until 2015, but recent strong data has led Fed officials to acknowledge they may need to act sooner than they thought just a few months ago.",Reuters,14646
14674,"Microsoft shares (O:MSFT) rose 10.1 percent to $52.87, their highest in 15 years, after adjusted revenue beat expectations for the ninth quarter in a row.",Reuters,3101
101983,"Subscription revenue rose because of new digital products that the company rolled out including the NYT Now app, which accounted for most of the increase.",Reuters,15525
86489,"Critics question the state's decision to throw so much money at Tesla, ending taxincentive programs for the film industry that had helped the Las Vegas area, along with incentives for the insurance industry.",Reuters,14315
95263,His wife named it after the eponymous animal's fur.,Reuters,15000
67673,"For instance, The refinery has bought highsulfur oil similar to Olmeca only occasionally over the past four years, according to EIA data.",Reuters,12855
37104,"Less wellestablished midstream companies may have to close, it said, forcing a consolidation in the market.",Reuters,8115
18305,The UAW had previously told the company that it would terminate the current labor contract if a new fouryear contract deal was not reached by 11:59 pm EDT on Wednesday on Thursday.,Reuters,3814
60195,"It has suspended ties with Shanghai Husi parent OSI Group LLC, and its Japanese unit shifted supply chain oversight to its chief financial officer.",Reuters,12093
52126," Indonesia wants to play a major role in a new Chineseled Asian infrastructure bank, with at least the vicepresident's position reserved for the Southeast Asian country, the finance minister said.",Reuters,11096
73727,"For each of the moves, NHTSA said, ""The closing of this investigation does not constitute a finding by NHTSA that a safety related defect does not exist.""",Reuters,13385
100304," Samsung Electronics Co Ltd said it will do 30 percent less business with a parts supplier after uncovering employment of child workers at the Chinabased firm, marking the IT giant's strongest objection to the illegal practice to date.",Reuters,15389
90427,The company said last week it would buy organic food producer Annie's Inc for about $820 million.,Reuters,14610
73768,"When Syngenta released its Agrisure Duracade corn this year, which is approved in the United States but not by China, it contracted grain handler Gavilon, owned by Japanese trading house Marubeni Corp, to oversee the launch.",Reuters,13387
38469,"China aims to create a modern Silk Road Economic Belt with railways, highways, oil and gas pipelines, power grids, Internet networks, maritime and other infrastructure links across Central, West and South Asia to as far as Greece.",Reuters,8447
9852,Suppliers say the machines reduce the need for human labor substantially.,Reuters,2140
28542,The combined company expects to save about $1.5 billion in annual costs by the end of 2017.,Reuters,6117
91120,"The General Assembly in June passed legislation that would, if enacted into law, allow sales to resume.",Reuters,14663
23722,"The Department of Justice, after years of criticism from lawmakers and the general public that people responsible for the 200809 financial crisis had not been held accountable, on Wednesday advised prosecutors to take a tougher stand against highlevel executives and other employees for wrongdoing under their watch.",Reuters,4906
108813,"""The authorities need to do their investigation to see if the accusations are valid, and to see where the pollution happened, whether it was deliberate or accidental,"" Abdul Shukor Husin, the council's committee chairman, told Reuters.",Reuters,16392
29356,"This lack of patronage becomes particularly painful as slower economic growth becomes the norm in China, and as consultants Euromonitor forecast growth in the already crowded fast food market to slow to around 4 percent by 2019, less than a third of the pace a decade earlier.",Reuters,6356
85071,Their leader's remarks raised the prospect of a more forceful attempt to make Hadi choose a candidate they prefer.,Reuters,14221
3741,"Higher interest rates make loans more expensive, crimping profit margins.",Reuters,856
85558,(Editing by Alessandra Galloni),Reuters,14250
29708,"The taxpayer could make at least 2 billion pounds on the Lloyds bailout, also at the height of the financial crisis.",Reuters,6450
90084,"Following the sale of its stake to Vivendi and the conversion of a threeyear exchangeable bond issued earlier this year, Telefonica will have ended its sevenyear partnership with Telecom Italia.",Reuters,14574
64624,"In his televised speech that followed, the group's leader AbdelMalek alHouthi warned Hadi that he had to implement the powersharing deal.",Reuters,12517
78540,South Korean shares  (KS11) were down 0.9 percent.,Reuters,13767
11064,Boeing and  Lockheed Martin  Corp (N:LMT) on Friday filed a formal protest against the decision.,Reuters,2410
100537,"A potential tieup would create one of the world's largest media conglomerates, dominating content production with two major studios, a stable of cable networks like Fox News and TNT, broadcast networks and payTV channel HBO.",Reuters,15405
61856,"Carpenter, who had done stints as an executive at Citigroup Inc (N:C) and General Electric Co's (N:GE) Kidder Peabody Group Inc, put ResCap into bankruptcy in 2012 and sold off foreign divisions.",Reuters,12251
4476,"Carlyle and Hellman & Friedman declined to comment, while PPD did not respond immediately to a request for comment.",Reuters,1033
91504,Spokesman Mikhail Leontiyev said Rosneft's lawyers were studying the sanctions and their implications for joint Arctic drilling with Exxon.,Reuters,14689
72345,"That could change if a more fundamental shortcoming, such as a design flaw rather than a manufacturing issue, was found to be at the root of the defects, or if there's a significant expansion in the scale of car recalls.",Reuters,13278
97068,"Rival American Apparel Inc also said samestore sales fell 6 percent, while revenue was flat in the second quarter ended June 30.Urban Outfitters Inc also reported flat samestore sales growth in the quarter ended July",Reuters,15157
80185,"On an adjusted basis, Visa's net income rose 14 percent to $1.4 billion, or $2.18 per Class A share, for the quarter ended Sept. 30.",Reuters,13857
20386,"Bank of America's thirdquarter trading revenue may fall between 5 percent and 6 percent due to weakness in its fixed income business, Chief Executive Brian Moynihan said at a conference less than two weeks ago.",Reuters,4183
13124,The company said it was aware of seven injuries related to the problem but no accidents.,Reuters,2815
70751,"Of students who enrolled in 2009, 90 percent had graduated within five years, Stanford said, compared with a fiveyear graduation rate of 92.2 percent five years earlier.",Reuters,13155
33969,"With sales of $86 billion last year, Singaporelisted Noble is one of Asia's largest firms to find itself in a reputational battle over accounts where consequences can be longlasting.",Reuters,7354
47353,"Navinder Singh Sarao, 36, will remain jailed in London for at least one night after bail was set at 5 million pounds ($7.5 million), along with other conditions.",Reuters,10258
27707,"Chinese stocks fell 6 percent on Tuesday, and further weakness in both that market and China's economy could play out very differently in these two funds.",Reuters,5879
54086,Shares of Cheung Kong had been halted since March 10.,Reuters,11343
27193,"Pioneer's goal is to eliminate the use of fresh water in fracking in 5 to 10 years, said McNair.",Reuters,5751
56459,"Some Chicago debt is trading at worse levels than bonds sold by Illinois, which is paying the biggest yield penalty among states in the U.S. municipal bond market due to its own fiscal woes.",Reuters,11663
