,sentences,source,article_id
858,"On that basis, a reduction of a roughly 20percent drop in sugar calories consumed could amount to 3.7 million tonnes  small relative to worldwide use of over 186 million tonnes, but still more than enough to meet the entire needs of Egypt.",Reuters,179
17912,"In a rare concession to protests, Lukashenko has also questioned whether Russia should be building a military air base in Belarus.",Reuters,3750
68277,"Brinsley, who was described by de Blasio as ""emotionally troubled"" and a ""career criminal"", shot and killed himself after slaying the officers.",Reuters,12924
65004,Shares of both FXCM and Leucadia were halted during the session.,Reuters,12577
101025,The company is spending more than $20 billion on five new projects it hopes will boost production 20 percent by 2017.,Reuters,15441
38724,The move came as the European Union told Greek Prime Minister Alexis Tsipras to stop gambling with his country's future and take crucial decisions needed to avert default.,Reuters,8501
110083," Barra also met with accident victims' families on Monday night in Washington, D.C., according to the company, ABC reported.",Reuters,16907
108752,(NYSE:TM) and Honda (NYSE:HMC) declined to comment.,Reuters,16368
39373,"For the quarter ended May 2, net loss attributable to shareholders was $303 million, or $2.85 per share, following a loss of $402 million, or $3.79 per share, a year earlier.",Reuters,8674
46691,Standard Chartered said it was listening to shareholders on whether it should consider moving.,Reuters,10162
36597,"Martin Schilling, a director at accounting firm PricewaterhouseCoopers, estimates that between 350 billion and 400 billion francs have left Swiss banks since the financial crisis, with the majority going to other European countries.",Reuters,7988
87201,"The study's authors analyzed about 50,000 earnings calls from 2002 to 2012, focusing on the nearly 9,500 that received little feedback during the open questionandanswer session of the call.",Reuters,14354
102998,"Auto sales in Europe remain 19 percent below 2007 levels, and factories are running at an average 72 percent of capacity despite the closure of several plants in the past three years, according to consultancy AlixPartners.",Reuters,15609
25740,"Suzuki, this isn't that much money,"" he added.",Reuters,5425
57600,"Derek Cohen, 52, admitted that he netted about $200,000 from a series of stock and options trades made after learning that the company planned to buy Atheros Communications in 2011, a statement from the U.S. Attorney's Office in San Diego said.",Reuters,11822
43800,"Transport links including harbor access were among the decisive considerations that ultimately weighed in South Carolina's favor, according to the carmaker.",Reuters,9639
102105,BP said secondquarter production fell nearly 3 percent to 3.1 million barrels of oil equivalent a day.,Reuters,15538
34412,"Their star expert witness, Raquel Gur, director of the Schizophrenia Research Center at the University of Pennsylvania, spent a grueling four days on the stand defending her diagnosis that Holmes was legally insane.",Reuters,7437
6342," Volkswagen (DE:VOWG_p) has split a 20 billion euro ($21.1 billion) bridge loan between 13 banks to help shoulder the costs of its emissions scandal, two people familiar with the matter said.",Reuters,1404
27796,"Copper futures CMCU3 fell 1.9 percent to $5,020.0 per tonne, a fresh sixyear low.",Reuters,5910
49341,Several investors said the time was right for HSBC to plan for a change.,Reuters,10587
15229,Valeant spokeswoman Laurie Little was not immediately available for comment.,Reuters,3228
49466,"The IFC declined to disclose how big an ownership stake it holds in Planet Labs, and it would not say whether it will require the company  or other U.S. startups it has invested in  to meet specific goals that would benefit developing countries.",Reuters,10610
38953,"About 6.5 billion shares changed hands on U.S. exchanges, above the 6.0 billion daily average for June so far, according to BATS Global Markets.(",Reuters,8551
40299,"Even with his big bet on healthcare, he's planning on adding more.",Reuters,8866
68204,"Shigehisa Takada, the grandson of the company founder, will become president.",Reuters,12918
19629,"There has not been a sustained UAW strike in decades, and this makes the first time a national contract negotiated between the UAW and a major car maker has been rejected since 1982.",Reuters,4048
37787,"    The company's story, recounted to Reuters by six current and former executives and employees, is not an isolated one.",Reuters,8311
58034,"One of the central issues, according to the union, is employee safety.",Reuters,11860
58952,"About 6.5 billion shares changed hands on U.S. exchanges, below the 7.3 billion average so far this month, according to BATS Global Markets.",Reuters,11956
66803," Morgan Stanley (NYSE:MS) said it has raised about $1 billion for a new credit fund, the latest in a series of private equitytype vehicles it is raising despite a new regulation that limits the bank's own participation in such funds.",Reuters,12752
18632,"""There's more risk in being that far away from the customer,"" said D. Steve Boland, the Bank of America executive in charge of mortgage and auto lending.",Reuters,3867
95144,Roche announced its proposed $8.3 billion cash purchase of InterMune on Sunday.,Reuters,14985
56505,The S&P 500 posted 26 new 52week highs and 2 new lows; the Nasdaq Composite recorded 93 new highs and 27 new lows.,Reuters,11667
94303,"Malmo Aviation, owned by Sweden's Braathens Aviation, was slated to be the first CSeries customer to take delivery of the new jet in the second half of 2015, but the airline said on Friday that will no longer be the case.",Reuters,14922
40921," The head of Airbus Group (PA:AIR) sought on Wednesday to reassure investors over the impact of a recent crash of the A400M military transporter, saying its subsequent partial grounding should not disrupt 2015 financial forecasts.",Reuters,9044
17560,"Financial companies are expected to show earnings growth of 8.4 percent, behind only telecoms and consumer discretionary companies in expected growth for the quarter.",Reuters,3692
72012,Data from the United States supported sentiment.,Reuters,13248
103008,"""Ford showed its first quarterly pretax profit in Europe in three years, despite a $329 million charge related to poor cash flow in the company's joint venture with Russian carmaker Sollers.",Reuters,15609
81924,"Revenue from the printing business fell 6 percent to $2.02 billion in the third quarter ended Sept. 30, from a year earlier.",Reuters,13989
83245,"Authorities involved in the sanctions settlement view the BSA probe as coming ""out of left field,"" one of the two sources said.",Reuters,14095
109689,OTHER BIDDERS              A Pfizer move on AstraZeneca might flush out other bidders.,Reuters,16753
15632,"""We have seen some opportunities to do some longerterm structural cost reduction,"" Hayes said.",Reuters,3316
12794,"Given its existing HAE presence, Ornskov acknowledged the deal would be scrutinized by antitrust authorities and he said Shire was already preparing for this.",Reuters,2729
56950,"""Emirates does its own thing.",Reuters,11741
74057,"Roughly 30 members of the sixth generation, aged between 15 and 30, are contenders to see if they could one day run Wallenberg's Investor holding company and several foundations with major stakes in Electrolux, Atlas Copco and Ericsson.",Reuters,13419
79018,"In the search for growth, Sanofi's focus on diabetes, rare diseases, emerging markets, overthecounter treatments, animal health and generics seemed to make sense.",Reuters,13795
72543,"The agency said its investigators found a number of design and manufacturing concerns that could have led to the short circuiting, including the presence of foreign debris and an inspection process that could not reliably detect defects.",Reuters,13294
100554,Both sources said Deutsche Telekom Chief Executive Tim Hoettges does not see Iliad's bid as attractive because he is skeptical that it would be able to cut out $10 billion in costs from the business as promised.,Reuters,15406
17408,"While the Justice Department does not have a seat at the table, it has volunteered analysis and answered questions from the other departments, the source said.",Reuters,3647
62756,"On Thursday, that consensus forecast was flat from a year ago including the energy sector, and cut to 7.9 percent growth excluding energy.",Reuters,12335
24650,"A Greek bank rescue fund financed by Greece's creditors pumped 25 billion euros into the banks in exchange for shares in 2013 and already holds majority stakes in National Bank, Piraeus Bank and Alpha Bank, and a 35 percent stake in Eurobank.",Reuters,5137
29782,"But at Toyota, price competition has particularly hit its RAV4 as car makers seek to capitalize on a vogue for SUVs.",Reuters,6458
26966,"one has any interest in a grassroots exploration project right now,"" said Yari Nieken, chief executive of Chlormet Technologies , which has bought an ecigarette company and has a license to grow medical marijuana pending.",Reuters,5704
91654,"Dennis Hudachek, a senior specialist with ETF.com, an expert on exchangetraded funds said several major Internet companies listed in the United States but based in China were affected by current index rules.",Reuters,14695
14178,"Major markets like Brazil are in a recession, or face lower growth rates, such as China,"" Chief Executive Kurt Bock said.",Reuters,3009
58172,"""Addressing concerns about rising deferred production costs for the 787, McNerney said it reflects investments to improve longterm productivity and that labor costs are ""coming down more slowly than we anticipated.",Reuters,11878
93979,"When Hospira was spun off from Abbott Laboratories ABT.N in 2004, Abbott retained a sizable and profitable medical nutrition business.",Reuters,14888
94657,"Socalled ""smart beta"" funds track a bespoke index that has been tweaked to weight it in different ways, using factors such as stocks' cheapness or price momentum.",Reuters,14944
100958,The accident at the Zhongrong Metal Products Co Ltd plant in Kunshan city in the eastern province of Jiangsu was China's worst industrial accident in a year.,Reuters,15432
24836,"Swiss asset managers were among the biggest investors in Madoff's scheme, with firms based in Geneva particularly hard hit.",Reuters,5161
41690,"One hurdle is the fees that major stores charge food makers to gain shelf space, which can run into the hundreds of thousands of dollars.",Reuters,9229
110089,The additional 14 deaths occurred after the 13 fatalities that GM has connected to defective ignition switches.,Reuters,16907
40783,[KOHLB.UL] took the company private in 2007 for $7.2 billion.,Reuters,8999
60101,"Last November, regulators fined six major banks a total of $4.3 billion for failing to stop traders from trying to manipulate the foreign exchange market, following a yearlong global investigation.",Reuters,12076
75288,Batista has said he was legally obliged to sell the stock to pay debts that had become due.,Reuters,13509
43410,"Last year, he correctly predicted that U.S. Treasury yields would fall, not rise as many had forecast, because inflationary pressures were nonexistent and technical factors, including aging demographics, were at play.",Reuters,9553
83202,"The S&P 500 (SPX) briefly turned negative for the year on Wednesday, though S&P 500 emini futures  added 0.4 percent, which might portend a more stable day ahead on Wall Street as investors await more U.S. data.",Reuters,14093
33851,"""We believe you will conclude that the merger would substantially lessen competition in violation of the antitrust laws, and should be blocked,"" they said in the letter.",Reuters,7317
104534,"Gold <XAU=> dipped as buyers cashed in on some of its 1.5 percent overnight jump, while the Japanese yen <JPY=> and U.S. government bonds <US10YT=RR>  investors' traditional goto safehaven assets  both gave up some ground.",Reuters,15761
22076,"If each car involved is found to be in noncompliance, the penalty could be $18 billion, an EPA official confirmed during the telephone conference on Friday.",Reuters,4548
60942,"""The concept is to sort of take this as an alternative to sodas, especially as we're seeing more and more consumer backlash to carbonated soft drinks in Latin America as well as Europe,"" said Jonas Feliciano, senior beverages analyst at Euromonitor.",Reuters,12160
29001,Schlumberger has said it has eight onshore refracking clients in North America.,Reuters,6288
44099,That is still a small share of MasterCard's around 2.2 billion cards in use globally.,Reuters,9701
8273,"Work said he only sounded out Sajjan when the two met in Halifax, Nova Scotia, adding: ""I wasn't here to put any pressure on.",Reuters,1861
26464,"Still, some Syngenta shareholders expressed disappointment over the scuttled deal and questioned Syngenta's ability to improve its financial fortunes.",Reuters,5553
70587,"That could save the company about $275 million from 2015 to 2018, based on a range of Wall Street earnings projections, it said.",Reuters,13144
104132,"At 1337 GMT, they were up 1.9 percent at 290.5 pence, topping the FTSE100 index.",Reuters,15728
71419,"The case is U.S. v Deutsche Bank AG et al, U.S. District Court, Southern District of New York, No. 1409669.",Reuters,13198
47963,"In Itaboraí, new office parks, hotels, stores and highrise apartments stand empty.",Reuters,10375
14200,Germany has ordered comprehensive tests on diesel models.,Reuters,3019
13825,"""Corporate results also helped push European stocks higher (FTEU3) (EU), with brewing giant  Heineken  (AS:HEIN) topping the FTSEurofirst 300 leaderboard with a near 4 percent rise after reporting strong sales.",Reuters,2944
79049,The improved guidance comes after Europe's largest lowcost carrier introduced a series of customer service improvements and offered a new business fare with free checkedin baggage and the ability to make flight changes.,Reuters,13796
39429,"SOVIET COLLAPSECuba's communist government first opened to international firms in the 1990s amid economic crisis caused by the collapse of the Soviet Union, its main ally and benefactor.",Reuters,8675
14515,"""We have had a pretty good rally in risk assets since the beginning of October ...",Reuters,3073
21131,"The deal, announced on Thursday, could be seen as the latest sign of U.S. exporters' unhappiness at the winding down of the U.S. ExportImport Bank, which lent money to foreign customers of U.S. exporters.",Reuters,4334
67197,"About 8.3 billion shares changed hands on U.S. exchanges, above the 5.5 billion average for the last five sessions, according to BATS Global Markets.",Reuters,12790
33771,"The bank paid an effective tax rate of 25 percent, down from 30 percent in the same quarter last year, as its tax bill dropped 13 percent to $2.81 billion.",Reuters,7308
17785,"Most recently he served as the executive vice president of food in which he was tasked by Greg Foran, the head of the U.S. operations, with improving the grocery operations with a focus on fresh food.",Reuters,3714
67621,Add in dividends and the advance is 15 percent.,Reuters,12854
17596,"""This is very, very clear.",Reuters,3697
71908,"In its latest move Sears said last month it might sell up to 300 stores to a real estate investment trust (REIT), which would then lease the properties back to Sears.",Reuters,13242
87655,"The AIG bailout, on the heels of the Lehman Brothers collapse in 2008, preceded the ""too big to fail"" auto and bank bailouts the federal government undertook during a U.S. financial crisis underpinned by faulty mortgage lending.",Reuters,14410
21072,"""Consumption is not done by government.",Reuters,4328
63390,"David MacLennan, who has led Cargill for the past 13 months, also revealed that unrest in Ukraine had affected plans for the company's expansion in the Black Sea, a key grainproducing region.",Reuters,12405
79852,"""The construction industry as a whole has several times the amount of work it used to have before the disaster.",Reuters,13830
31968,"The world's largest construction and mining equipment maker reported secondquarter net income of $710 million, or $1.16 per share, down from $999 million, or $1.57 a share a year earlier.",Reuters,6936
32043,The Commission said in a statement its preliminary view was that each of the six studios and Sky UK had agreed contractual restrictions preventing EU consumers outside Britain and Ireland from accessing films shown by the broadcaster.,Reuters,6943
78369,"Bill's recent decision to resign, the perception has been that there has been a dramatic shift at Pimco,"" Pimco CEO Doug Hodge said in a letter to clients last month.",Reuters,13754
37857,"""He was eternally optimistic that a deal could be done when he started one,"" Jack Welch, former Chairman and Chief Executive of  General Electric  Co, (N:GE) told Reuters.",Reuters,8314
102631,"No charges have been filed against Leach, 43, the paper said.",Reuters,15582
29413,He is happy with the move despite the higher cost of living there.,Reuters,6367
14549,"""We look forward to presenting the details of these gains to local union leaders and the membership.",Reuters,3086
57944,The leadership team of Morgan Stanley's wealth management business has been visiting brokerage offices around the country to reassure advisers and clients in the wake of the data theft.,Reuters,11856
26274,The euro rose a third of one percent above 136 yen.,Reuters,5528
2697,"The new campaign, discussed last week at a closeddoor meeting of 2,000 group managers, is VW's latest attempt to regain the initiative in rebuilding its reputation following a sharp drop in sales in some markets, including the United States and Britain.",Reuters,655
31596,"""Swedish said he intended to remain CEO of the combined company for two years, and afterward become chairman.",Reuters,6866
47042,Analysts have expressed concern that Boeing might have to cut prices to shore up any production gap.,Reuters,10225
75932,"For the first time, the platform will also be able to manage and make secure medical diagnostic equipment, industrial machinery and even cars.",Reuters,13570
1139," Mitsubishi Motors (T:7211) said on Thursday it would close its sole production plant in the United States as the Japanese automaker cuts losses on dwindling sales in North America and a strong U.S. dollar, which has stymied returns.",Reuters,233
47618,"""They want to maintain their pricing and their image and will have to take some of the competitive knocks that go with that.",Reuters,10301
7329,"Sonnenbatterie this week announced a 3,599 euro small battery  a discounted price available if the buyer joins the company's SonnenCommunity scheme.",Reuters,1610
18998,"""The decline in orders from abroad paints a dim picture,"" said Thomas Gitzel, an economist at VP Bank.",Reuters,3925
1572,He added VW's workers should not be made to bear the responsibility for the misconduct of those who carried out the emissions test cheating.,Reuters,329
104060,"Shares in Julius Baer had fallen by around 9 percent since the Credit Suisse settlement, lagging an index of European banks which was down by 2.6 percent since then.",Reuters,15724
13147,U.S. Treasury yields also slipped back from this week's highs.,Reuters,2816
91548,They also doubt that fund managers do enough trading on their own to justify a new stock market.,Reuters,14690
83113,"Stocks have been sliding in recent days on worries about the health of the global economy, and bank shares have been hit hard.",Reuters,14084
42575,"""There was a time when we used a lot.",Reuters,9391
52780,"The fourthquarter effect was about $18.66 billion, according to Koester.",Reuters,11200
20449," Japan Tobacco Inc has agreed to pay 600 billion yen ($5 billion) in cash for Reynolds American (NYSE:RAI) Inc's Natural American Spirit tobacco business outside the United States, the two companies said in separate statements on Tuesday.",Reuters,4208
39965,"""Decisions about modular platforms must be taken in Wolfsburg,"" Osterloh said, adding that the group's headquarters in Wolfsburg should receive the power to oversee whether the brands are complying with the platforms' specifications.",Reuters,8806
99601,Russia said on Wednesday it would ban all food imports from the United States and all fruit and vegetables from Europe in a strongerthanexpected answer to Western sanctions for Moscow's support for separatists in Ukraine.,Reuters,15334
2031,"Plc will pay more than $13.75 million to settle a U.S. regulator's charges that it allowed customers to make more than 6,100 unsuitable mutual fund switches, and failed to provide some customers discounts on large fund transactions.",Reuters,487
56788,"An official at the procurement agency said there were many reasons why local makers might be preferred, including sheer weight of numbers and the fact that domestic security technology firms offered more product guarantees than overseas rivals.",Reuters,11721
85026,"WhatsApp works across different types of phones, across borders, and without advertising.",Reuters,14216
106121,"Miner Alcoa Inc AA.N reported results after Wall Street closed that beat analysts' expectations, but that was not enough to help European equities recover after posting their biggest fall in three months on Tuesday.",Reuters,15938
33994,"""Greece's leftist Prime Minister Alexis Tsipras faces a showdown on Tuesday with rebels in his own party, furious at his capitulation to German demands for one of the most sweeping austerity packages ever demanded of a euro zone government.",Reuters,7356
62776,"The company has said it plans to open 10 U.S., companyoperated restaurants each year and could eventually grow to at least 450 locations.",Reuters,12336
88680,"Still, Rohler is watching pro football games on television.",Reuters,14480
110111,             A February 2005 entry in the congressional committee's chronology illustrates that engineers were grappling with what to do about the defective ignition switches.,Reuters,16915
70657, (Reporting By Jed Horowitz.,Reuters,13149
22693,"The incident has launched a social media campaign called #IStandWithAhmed, which was the No. 1 trending topic in the United States on Twitter for most of Wednesday with nearly 1 million tweets, many critical of the school district and police.",Reuters,4671
50175,"More toy company deals are expected in 2015, according to Reuters interviews with private equity firms.",Reuters,10744
78882,"GM has given Feinberg  a Washington attorney who has overseen compensation for victims of the Sept. 11 attacks and the Deepwater Horizon oil spill, among others  free rein to determine eligibility criteria and approve or reject claims.",Reuters,13789
31083,"New Yorkbased McGraw Hill said it expected the deal to add to diluted earnings per share in 2016, excluding amortization and special items.",Reuters,6769
101226,TMobile shares closed up 6.5 percent at $32.94 on the New York Stock Exchange.,Reuters,15456
73391,"The ruptured inflator involved in the 2002 Honda recall was not mentioned by Schostek in the Senate hearing because ""it is not relevant to the issues associated with the Takata air bag inflator ruptures that were the subject of the hearing,"" the spokesman said.",Reuters,13352
1601,"The bank stressed on Monday that its independence after the death of Hans Vontobel, the largest single shareholder, had been ""a matter of great importance"" to him.",Reuters,340
7893,"The U.S. economy grew at a 2.1 percent pace in the thirdquarter, compared with an earlier estimate of 1.5 percent, data showed, but consumer sentiment in November was the weakest since September 2014 ahead of the crucial holiday shopping season.",Reuters,1752
105336,That is down from 260 deals worth $34 billion at the Paris Airshow last year.,Reuters,15823
11786,It rose as high as $1.0834 per euro on Thursday before steadying.,Reuters,2572
55764,"In line with such gains spreadbetters forecast a slightly higher open for Britain's FTSE (FTSE), Germany's DAX (GDAXI) and France's CAC (FCHI).",Reuters,11572
53497,"Group Inc (N:KFT) and Kellogg Co (N:K).Besides the Annie's purchase, General Mills has altered its Yoplait yogurt to appeal to healthconscious consumers by simplifying ingredients and removing high fructose corn syrup and artificial colors and flavors.",Reuters,11272
103345,The news injected some life into a sluggish session and helped China's CSI300 index of leading Shanghai and Shenzhen,Reuters,15642
64482,"Salesforce declined to comment, while the other companies were not immediately available for comment.",Reuters,12506
71059,"The Justice Department said it sought the extension in part because it had obtained information about ""possible historical violations"" of U.S. sanctions laws that took place after 2007.",Reuters,13171
76366,"The central bank, whose boss Mark Carney is leading global regulatory efforts to reform financial benchmarks, has dismissed Mallet but said he had not done anything illegal or improper.",Reuters,13608
32409,"An Aberdeen affiliate had a very small equity holding in Toshiba as of endMay, Reuters data shows.",Reuters,7011
102852,"""O'Shea has a ""buy"" rating on BSkyB shares.",Reuters,15598
48559,"Volvo, meanwhile, plans to use the CMA platform to upgrade its small vehicles, producing them at the new China assembly plant and in Europe.",Reuters,10460
60577,"""Those investigations include a ""forensic audit"" of the oil industry set up by OkonjoIweala.",Reuters,12122
90145,"Shamrock Farms, a Phoenixbased milk producer, began selling its ""Rockin' Refuel"" muscle building milk in 2009 with added protein.",Reuters,14578
