,sentences,source,article_id
98959,"Companies are giving staff practical coaching, including holding mock raids, and bringing in legal experts to train them on how to handle intense, onthespot questioning, negotiate cultural hurdles, and make contingency arrangements to source emergency legal advice.",Reuters,15286
52243,"The Brazilian private equity firm is looking at new acquisition targets after investors pledged about $5 billion to form a new takeover fund, the Journal had reported in January.3G Capital has been criticized in the past for its decision to cut thousands of jobs at Heinz.",Reuters,11134
50345,MEGA MERGERThe halving in crude prices on the back of a shale oil boom in the United States and a decision by Saudi Arabia not to cut production has created an environment similar to the early 2000s when many supermergers took place.,Reuters,10772
24397,"Still, the tax exemption provides an incentive for Keurig, the tax experts said.",Reuters,5077
41754,"Transocean, which owned the Deepwater Horizon rig, had settled its Clean Water Act liability for $1 billion.",Reuters,9232
99939,"L.P. (KKR) took Alliance Boots, which runs the Boots chain of pharmacies that dot main streets across Britain, private in 2007.",Reuters,15362
47445,Brookfield Asset Management's offer of $28.75 per share is at a premium of 17.4 percent to Associated Estates' closing price on the New York Stock Exchange on Tuesday.,Reuters,10278
74308,"""We will continue to meet our responsibility  we will do what we must to raise inflation and inflation expectations as fast as possible,"" Draghi said in a heavyweight speech.",Reuters,13437
50031,"Boeing officials deny this and say their rival has lost the argument because the wider fuselage on jets like the 777 allows for more seats in each row, without sacrificing comfort.",Reuters,10725
18657,"""I've already got a relationship with the customer,"" said Boland.",Reuters,3867
71537,"The disappointing Chinese and Japanese data contrasted sharply with Friday's U.S. nonfarm payrolls that showed employment in November surged by 321,000, easily topping forecasts for 230,000 new jobs.",Reuters,13209
101378,"According to one internal website, Amazon intends to take a 20 percent cut of jobs under $1,000 by August 14 and 15 percent for services over $1,000.",Reuters,15466
27607,Yum China booked four consecutive quarters of steep samerestaurant sales declines following allegations of improper meat handling at OSI Group's Shanghai Husi Food Co Ltd in July 2014.,Reuters,5862
63664,Blackstone Advisory Partners LP was financial adviser to RockTenn in the deal.,Reuters,12441
103992,The company operated 72 stores in the region as of Jan. 31.,Reuters,15718
70752,Some students say they are quitting to start companies.,Reuters,13155
24423,AutoNation said its policy would apply to all 293 U.S. stores and cover wholesale and retail transactions.,Reuters,5078
18473,"A deadline extension can be granted if SABMiller asks for it, and AB InBev wants shareholders to lobby the company.",Reuters,3832
20464,European shares partially recouped early losses but most major indexes remained near 2015 lows.,Reuters,4210
78035,"As of Feb. 22, Eissenstat also owned shares in Continental valued at more than $7 million, SEC filings show.",Reuters,13724
29352,"Experts say it's premature to forecast what action, if any, the auditor will face in this instance.",Reuters,6355
85258,"Ford joins Deutsche from Goldman Sachs, where she was global head of compliance for Goldman's investment banking and merchant banking divisions and the executive office.",Reuters,14232
105719,"Investors will also grapple with a host of economic data on Tuesday, with June import prices, the July New York Fed manufacturing survey, and June retail sales data all due at 8:30 a.m.",Reuters,15852
104959,Chip maker Intel Corporation (NASDAQ:INTC) and network equipment maker Cisco Systems Inc (NASDAQ:CSCO),Reuters,15792
67363,"They said traders would use such names as The Cartel, The Bandits' Club and The Mafia to swap confidential orders, and set prices through manipulative tactics such as ""front running,"" ""banging the close"" and ""painting the screen.""",Reuters,12819
31612,"Energy Future filed for bankruptcy protection in 2014, squeezed by weak power prices and unsustainable debt.",Reuters,6872
31632,"While the rising level of deferred costs affects the 787's ultimate profitability, Solomon said, ""it's the ongoing cost that we're really paying attention to.""",Reuters,6873
45123,"It's unlikely that the board  evenly split between investor and labor representatives  will reach a decision on a new chairman, one source said, declining to be more specific.",Reuters,9903
76848,"Halford said the bank was aware of investor concerns, including whether its cost cutting plans went far enough and whether its capital was high enough.",Reuters,13636
1109,China's securities regulator also unveiled new rules on Thursday to restrict selling by big shareholders who have been locked into their holdings for six months since Beijing banned them from offloading stocks to arrest a summer market crash.,Reuters,216
65913,"Higher targets are necessary because of increased costs of holding more capital and complying with additional regulatory requirements, including antimoney laundering rules, Larsen said.",Reuters,12671
25963,That could mean a costly upheaval for retailers and brands to change packaging and invest in new systems and scanners.,Reuters,5479
13971,"The $9ashare cash deal, worth $17.2 billion including acquired debt, will increase the footprint of Walgreens, the largest U.S. drugstore chain, by half.",Reuters,2963
80135,"The dollar hovered near a threeweek peak of 109.145 yen  after rallying nearly 0.7 percent overnight in light of the Fed's statements, while the euro fell to a threeweek trough of $1.2605 .",Reuters,13853
64981,"The company had invested heavily in its supply chain operations, but a combination of dataentry and ordering errors, poor training, and confusion over differences between U.S. and Canadian systems resulted in empty shelves for key merchandise and overstocking of other products.",Reuters,12574
6762,"  Lockheed Martin  Corp (N:LMT) has been awarded a contract worth $914 million to upgrade Singapore's F16 aircraft, the Pentagon said on Tuesday.",Reuters,1483
55104,"While at Prudential, Thiam failed in an attempt to take over Asianfocused insurer AIA (HK:1299) in 2010 after a shareholder rebellion.",Reuters,11477
35638,The size of the settlement was slightly more than the $17.6 billion that investors had initially feared BP would be fined for gross negligence under the Clean Water Act alone.,Reuters,7756
40317,"The Nasdaq Biotechnology index is up 52 percent over the last year, while the S&P Pharmaceuticals index is up 33 percent over the same time.",Reuters,8866
68571,"They estimated the boost to world growth would be between 0.3 and 0.7 percentage points above the Fund's baseline forecast of 3.8 percent in 2015, with the gain to China ranging from 0.4 to 0.7 percentage points.",Reuters,12949
100901,"Meanwhile at home, the troubles also piled on.",Reuters,15428
88247,"Airbus lost one of its existing A380 customers in July when it revoked an order for six A380s from Japan's Skymark Airlines, which faced difficulties financing its purchase.",Reuters,14451
51428,"""We bought DuPont before this happened, and we do think this is, at minimum a distraction, at maximum a dislocation to the plan that is in place,"" said Robert Zagunis, managing director of Jensen Investment Management, which owns 1.8 million DuPont shares.",Reuters,10984
78972,"""The execution focus was not sufficient,"" Weinberg said.",Reuters,13795
13418,Qantas' commitment to the 787 had been in doubt after it canceled 35 orders for the stretched 7879 model in 2012 amid financial losses.,Reuters,2852
107291,"GOL/ Spot gold XAU= fell 0.3 percent to $1,323.55 an ounce, pulling back from a 3month high of $1,332.10 hit earlier this week as tensions in Iraq and Ukraine stoked safehaven demand.",Reuters,16052
50352,"The industry as a whole has also developed too many projects set to come onstream in the next few years, likely to cause a glut and an price collapse several years down the road, analysts have said.",Reuters,10772
56956,"Adjusted earnings per share, which excludes items including a massive loss related to the Canada exit, came to $1.50 in the fourth quarter.",Reuters,11742
16756,"That sector will be headed by Kathy Warden, now corporate vice president and president of Information Systems, Northrop said.",Reuters,3509
103133,The SEC said it would give the settlement money to investors who were harmed by the bank's misrepresentations.,Reuters,15617
22219,Research firm IBISWorld estimates that PetSmart and Petco collectively account for more than half of the U.S. pet stores industry's revenue.,Reuters,4569
31956,United's outlook reflects the challenging revenue environment that U.S. airlines continue to face as the strong dollar lowers foreign travelers' spending power in the United States.,Reuters,6933
18589,"Managing Director Nick Lawson, adding that after a rough September investors were ready to put more firepower into rebound bets.",Reuters,3859
43230,"""It's a gauge of people's perspectives as to what the Fed will do next,"" said Frankel, adding that utilities are in favor if people think the Fed will stall on interest rate hikes.",Reuters,9510
17751,"United Continental Holdings Inc intends to compete on price when necessary, add destinations and offer easy connections to keep customers, Jim Compton said.",Reuters,3713
48438,"""The contract signed on Friday for the classic A380 includes a longterm ""Totalcare"" package, which means RollsRoyce will also provide service and maintenance to Emirates.",Reuters,10442
50369,"""Thanks to our wellestablished partnership with the RenaultNissan Alliance, we are able to drastically reduce the time and cost to enter this key segment.",Reuters,10782
75026,Stock exchanges and some SEC commissioners were upset that the initial plan did not capture more large broker dealers who match investors' orders internally.,Reuters,13485
27509,"AnheuserBusch InBev, maker of Budweiser and Stella Artois, has made a string of craft beer company acquisitions in the last 18 months that include Blue Point Brewing, Elysian Brewing and 10 Barrel Brewing.",Reuters,5842
91231,"For Nissan, the plant cuts would be a partial retreat from the automotive battery market  expected to top $20 billion by 2020  just as Californiabased Tesla builds its $5 billion ""Gigafactory"" with Panasonic (T:6752) in Nevada.",Reuters,14671
55469,"Shares of Office Depot, which reported lowerthanexpected quarterly sales last week, were down 0.5 percent.",Reuters,11535
86578,"Others on the board have experience in telecoms, media, finance and cars, while Patrick Cescau, the board's senior independent director, is a former chairman of Unilever (L:ULVR), one of Tesco's biggest suppliers.",Reuters,14318
58397,"Shares of the company, which had jumped more than 40 percent on the Toronto Stock Exchange since being listed in December, rose another 7.7 percent on Tuesday to C$51.96.",Reuters,11908
71870,"For example, the twoyearold, $576 million JPMorgan Global Bond Opportunities Fund, received $346 million in inflows since Sept. 26, the day Gross quit, according to",Reuters,13241
101720,"WHY IRELAND?Ireland is not the only home for inversions  Britain, the Netherlands and Switzerland are also popular.",Reuters,15500
64608,"For now at least they appear to have decided to stop short of overthrowing Hadi, possibly preferring to exert control over a weakened leader rather than take on the burden of power.",Reuters,12517
74465,but it's still important,Reuters,13451
58080,"The Association for Unmanned Vehicle Systems International, an industry trade group, also reserved judgment for now.",Reuters,11862
57719,"All three companies' disinfection recommendations were approved by the FDA.Some experts advocate the use of disposable, singleuse instruments, rather than reusable ones that must be sterilized after every procedure.",Reuters,11830
36128,"The final transaction is still large enough to secure production of one of Airbus's most profitable planes, but one which is heading towards a revamp after 20 years in the market.",Reuters,7869
16418,"Falling prices for used widebody planes, especially Boeing's older 777200ER, are making new sales more difficult.",Reuters,3456
63939,Total CEO Patrick Pouyanne also said it would maintain dividends while Eni chief Claudio descalzi told Reuters television he was confident prices would rebound and that the company would be also able to sustain dividends.,Reuters,12469
70133,The former casino floor would be converted to administrative offices.,Reuters,13111
43596,"Hyundai Motor Co's Santa Fe, FCA's Jeep Cherokee and Dodge Durango were rated ""marginal"".",Reuters,9602
63915,"Deere had about 59,600 fulltime employees as of Oct. 31, including approximately 29,000 employees in the United States and Canada.",Reuters,12467
7034,"This will allow the foreign companies to offer more attractive options while keeping vehicle prices competitive with the unionized Detroit Three automakers, or charge less for their vehicles.",Reuters,1551
94984,"The PHLX housing index (HGX) lost 0.4 percent, but was off earlier lows.",Reuters,14970
22255,"""We thought it was better because it was shorter.",Reuters,4590
19973,It not immediately clear if the contract announced Wednesday would encompass those upgrades.,Reuters,4107
31949,"Separating it from FCA's brands such as tiny Fiat 500s and sporty Maseratis is an ""act of purification"" to unlock value at both, Marchionne has said.",Reuters,6921
48357,"This, in turn, could renew politically charged debates over Google's tax avoidance moved and privacy safeguards.",Reuters,10435
5779,Bumper harvests in the past decade have also reduced the urgency for new technologies.,Reuters,1296
1480,"In a bid to stabilize its markets, the People's Bank of China on Tuesday injected $20 billion into the financial system.",Reuters,304
43453,"McNerney reaffirmed Boeing's goal of generating more than $9 billion in operating cash flow this year, and said that figure will increase in 2016 and beyond.",Reuters,9564
14199,"On a visit to Washington, Dobrindt said he had updated his U.S. counterpart, Anthony Foxx, on measures Germany has taken to clear up the scandal and would keep the U.S. government regularly informed on developments.",Reuters,3019
84866,"In keeping with Cadillac's new naming scheme, the future crossovers are expected to carry the designation XT to distinguish them from sedans that will be called CT.",Reuters,14206
29883,"Its stock fell 2.36 percent, weighing most on the Nasdaq and the S&P 500.The company's shares slipped below their 200day daily moving average, a key technical level closely watched by traders, for the first time in nearly two years.",Reuters,6476
89740,"""I think GSK is a buy when the CEO of that business goes,"" said John Bennett, a director of European equities at Henderson Global Investors, which has a holding in the drugmaker.",Reuters,14543
93144,"The passenger load factor, a measure of the portion of capacity filled, rose 1.1 percentage points to 89 percent, the carrier said in a statement.",Reuters,14817
4063,"Chung told the gathering that the company must build on the launch of new ecofriendly vehicles and the rollout of its highend Genesis brand, Yonhap said.",Reuters,948
75721,A spokesman for Porsche SE rejected the allegations.,Reuters,13553
55050,The steep drop in oil prices has worried investors about GE's business supplying equipment and services to the energy industry.,Reuters,11469
36163,"Diess summarized his views on Wolfsburg in a scathing internal report, telling superiors the plant's workforce of 50,000 is bloated with staff whose services are no longer needed but who haven't been fired, a BMW source said.",Reuters,7873
65731,FOREIGN PRESSUREShiramizu is an unlikely scourge of the Toyota tradition.,Reuters,12655
26014,"After the $23 billion offer was rejected by Micron in July, Xu Jinhong, chairman of Unigroup's parent company Tsinghua Holdings, told Reuters that Tsinghua had not given up, saying he hoped the deal ""could eventually come through"".",Reuters,5480
96071,"Qualcomm is one of at least 30 foreign firms to come under scrutiny as China seeks to enforce a 2008 antimonopoly law which some critics say is being used to unfairly target overseas businesses, raising protectionism concerns.",Reuters,15068
23724,"The policy will be incorporated into the US Attorneys' Manual, which federal prosecutors look to for guidance.",Reuters,4906
40413,"In a 60page submission to the U.S. government Sunday made publicly available Monday, Etihad said U.S. Open Skies policy did not prohibit airlines from receiving shareholders loans.",Reuters,8872
99796,"China, which had 153 nationals on board MH370, has been heavily involved, providing ships, aircraft and satellite technology.",Reuters,15353
85402,"Of WalMart's 1.3 million U.S. employees, the company said 1.2 million currently elect to be covered under the company's health insurance plans.",Reuters,14240
92380,The UK arm is also looking for a new chairman.,Reuters,14758
104870,"But his pledge at the Davos World Economic Forum in January that women would occupy 30 percent of leading jobs in Japan by 2020 is lofty: Women now account for only 11 percent of midtosenior management and just 1 percent of executive committee members, according to McKinsey.",Reuters,15788
57137," Comcast Corp (NASDAQ:CMCSA.O), the largest U.S. cable operator, posted fourthquarter revenue that marginally beat estimates as the company added new video and highspeed internet customers.",Reuters,11769
82654,"""We are now in a blackout period so companies have been precluded from conducting tactical buyback activity that has supported the equity market during selloffs in the recent past,"" said Goldman Sachs in a note earlier this week.",Reuters,14057
97916,"He still owns about onefifth of Berkshire, which was a failing textile company before he took it over in 1965, and controls about onethird of its voting power.",Reuters,15209
79323,"Yet for nearly a year longer, BNP continued to process payments for the company, transactions involving over half a billion dollars, the documents noted.",Reuters,13809
92499,"Alibaba, could set a new record for the world's biggest IPO if underwriters exercise an option to sell additional shares to meet demand  putting it as high as $24.3 billion, and overtaking Agricultural Bank of China Ltd's $22.1 billion listing in 2010.",Reuters,14765
45617,"The S&P tech index  slid 1.6 percent, the day's worstperforming sector, while smallcap stocks also underperformed.",Reuters,9946
22359,"Financial markets, which have constantly forecast a far slower pace of policy tightening than the Fed's projections, were less convinced.",Reuters,4612
78192,"Warren Buffet's conglomerate Berkshire Hathaway (N:BRKa) was ranked the sixth least transparent multinational, and the report said major tech companies also performed relatively poorly.",Reuters,13738
10005,"At the time, Treasury and the Internal Revenue Service said they were weighing further actions.",Reuters,2157
81880,"Dow's plastics business has benefited from a shale boom in the United States that has pulled down prices of raw materials such as ethane and naphtha, giving the company an edge over oildependent European rivals.",Reuters,13987
10334,"A quarter of new managing directors are women, the highest percentage ever for the bank, Goldman Sachs said in a statement.",Reuters,2221
1258,"Starboard in a letter to the board of directors implied that Mayer and her officers needed to go, without naming her specifically.",Reuters,253
49530,"McDonald's Corp (N:MCD) has also been stung in China by food scares, but moves to upgrade stores and roll out its McCafe concept have helped offset the damage, analysts said.",Reuters,10628
109632,"The offer, if successful, would bring together two midsized pharmaceutical companies with expertise in skin care and eye care products, and is highly unusual as activist investors typically buy stakes and then agitate for strategic change.",Reuters,16737
38531,"Orders are seen lower this year after a series of record or nearrecord annual performances, partly because planemakers are sold out six or more years ahead, but demand for widebody longdistance jets remains strong, Wojick said.",Reuters,8457
51562,"Volvo may find the going tougher than in its U.S. heyday, which saw 2004 deliveries approach 140,000.",Reuters,10999
64005,"The offer of additional yield moved the syndication forward, however.",Reuters,12473
85191,Tesco is now reeling from an accounting scandal and a downturn in trading that has knocked 4 billion pounds off its market value in a matter of weeks.,Reuters,14228
45432,The benchmark S&P 500 index posted 10 new 52week highs and no new lows; the Nasdaq Composite recorded 35 new highs and 69 new lows.,Reuters,9929
14350,"Donaldson, whose Evansville, Indiana, firm holds UPS shares, said he was confident the company would do better this year.",Reuters,3037
89527,"Boeing says it responds to market forces, though it is also less constrained by Europe's labour laws.",Reuters,14530
81173,"There was also focus on Russia and Ukraine, with Russia facing a rating review from Standard & Poor's later and elections taking place in Ukraine on Sunday.",Reuters,13945
86665,"""It is the first vehicle we will put on the road here where there really is no reason for rejection in terms of either size or capability.""",Reuters,14322
90662,"Bank of America has been able to take out more than $4 billion in costs after shrinking the businesses in which it is involved and deciding to stop trying to add new customers, Athanasia said.",Reuters,14636
77897, Britain's big banks could be broken up after the country's competition watchdog launched a fullblown investigation into services for small business customers and personal accounts because of a lack of competition.,Reuters,13722
43829,Many Muslims regard depictions of the prophet – such as the caricatures displayed at the event  as offensive and against the religion's teachings.,Reuters,9653
48660,"The plan aimed at ""improving efficiencies and capacity utilization and integrating its manufacturing operations,"" Whirlpool said in a statement.",Reuters,10472
89711,"The fuelpump relay is inside an integrated power module that helps manage other vehicle function, but none of those other functions are affected, Chrysler said.",Reuters,14541
11592, Walt Disney Co reported a rise in quarterly profit that beat Wall Street forecasts as cable networks including ESPN brought in higher advertising revenue and collected more fees from pay TV distributors.,Reuters,2524
102424,"Nissan recalled 755,500 vehicles globally in June, expanding a recall from April 2013.",Reuters,15561
103206,"Ford surprised analysts by posting a profit in Europe, its first in the region in three years.",Reuters,15620
52624,"Shares in the firm, down 6.3 percent over the last six months, closed Friday at 453.5 pence, valuing the business at 891 million pounds ($1.3 billion).($1 = 0.6712 pounds)",Reuters,11189
45025,"""Things in Europe seem pretty calm, we haven't heard anything out of China, and against that backdrop, some of the earnings reports are looking better.",Reuters,9879
65428,RadioShack's shares have fallen nearly 60 percent since its bankruptcy warning through Tuesday's close.,Reuters,12626
29062,"J.P. Morgan's Goldman, though, said Kraft Heinz backer 3G Capital might be reluctant to make another acquisition so soon after its $46 billion deal to combine Kraft and Heinz.",Reuters,6301
47352," A British trader accused by U.S. authorities of market manipulation that contributed to the May 2010 Wall Street ""flash crash"" was granted bail by a London court on Wednesday, after saying he opposed extradition to the United States for a trial.",Reuters,10258
95717,"U.S. Tnote futures were flat at 12557/64, with cash 10year yields (US10YT=RR) trading at 2.41 percent.",Reuters,15041
39868, U.S. agrochemicals firm Monsanto Co and its advisers are working flat out to accommodate Syngenta's qualms about regulatory hurdles to a deal whose perils may well outweigh the rewards.,Reuters,8749
29693,"But the sale was more about starting the process of returning RBS to the private sector and showing investors the government is reducing its interference in the bank, rather than avoiding a loss, people familiar with the decision told Reuters.",Reuters,6450
3422,It is case No. 152115.,Reuters,790
98415,"A bonus scheme granting employees at a listed company shares in an unlisted affiliate doesn't raise any legal concerns, but it is unusual for a firm to allow an executive to independently determine compensation, corporate governance experts say.",Reuters,15245
43593," Most midsize SUVs being crashtested by a U.S. safety group fared poorly, with the worst performer being the Dodge Journey, which sustained severe structural damages.",Reuters,9602
89900,"Ted Frank, a critic of what he considers excessive legal fees and who represented a couple opposing the RadioShack settlement, in a phone interview welcomed the decision.",Reuters,14558
33917,"The looming debate pits Democrats, federal regulators, safety advocates and environmentalists against the crudebyrail industry, which claims that installing the brakes would slap an unnecessary $3 billion cost on railroads, oil refiners and other owners of rolling stock, and potentially jeopardize safety.",Reuters,7344
84409,Notable buyers include the $29.3 billion BlackRock Equity Dividend Fund and the $9.2 billion T. Rowe Price SmallCap Stock fund.,Reuters,14185
20053,"Production will begin in 2018 at Navistar's plant in Springfield, Ohio.",Reuters,4140
